{
  "$schema": "https://json-schema.org/draft/2020-12/schema",
  "$id": "https://github.com/sf9-26/provbind/contracts/envelope.schema.json",
  "title": "PROVBIND envelope v0",
  "description": "Written by Role 2 (compiler), read by Role 3 (verifier) and Role 4 (scoring, Neo4j). Unknown fields are allowed and must be ignored by readers.",
  "type": "object",
  "required": ["schema", "image", "layers", "files", "symlinks", "closure", "packages",
               "capabilities", "unresolved_fraction", "compiled_at"],
  "properties": {
    "schema": { "const": "provbind.envelope/v0" },
    "image": {
      "type": "object",
      "required": ["ref", "digest", "builder_id", "source_commit", "rekor_log_index"],
      "properties": {
        "ref":             { "type": "string", "pattern": "@sha256:[0-9a-f]{64}$" },
        "digest":          { "$ref": "#/$defs/digest" },
        "builder_id":      { "type": "string", "pattern": "^[A-Za-z][A-Za-z0-9+.-]*:" },
        "source_commit":   { "type": ["string", "null"] },
        "rekor_log_index": { "type": ["integer", "null"] }
      }
    },
    "layers": {
      "type": "array", "minItems": 1,
      "items": {
        "type": "object", "required": ["index", "digest"],
        "properties": {
          "index":      { "type": "integer", "minimum": 0 },
          "digest":     { "$ref": "#/$defs/digest" },
          "media_type": { "type": "string" }
        }
      }
    },
    "files": {
      "type": "object",
      "propertyNames": { "$ref": "#/$defs/abspath" },
      "additionalProperties": {
        "type": "object", "required": ["sha256", "layer", "package", "mode"],
        "properties": {
          "sha256":  { "type": "string", "pattern": "^[0-9a-f]{64}$" },
          "layer":   { "type": "integer", "minimum": 0 },
          "package": { "type": ["string", "null"] },
          "mode":    { "type": "string", "pattern": "^0[0-7]{3,4}$" }
        }
      }
    },
    "symlinks": {
      "type": "object",
      "propertyNames": { "$ref": "#/$defs/abspath" },
      "additionalProperties": { "oneOf": [ { "$ref": "#/$defs/abspath" }, { "type": "null" } ] }
    },
    "closure": { "type": "array", "uniqueItems": true, "items": { "$ref": "#/$defs/abspath" } },
    "packages": {
      "type": "object",
      "additionalProperties": {
        "type": "object", "required": ["depth"],
        "properties": { "depth": { "type": ["integer", "null"], "minimum": 0 } }
      }
    },
    "capabilities": {
      "type": "array",
      "items": {
        "type": "object", "required": ["cap", "origin"],
        "properties": {
          "cap":    { "type": "string", "pattern": "^CAP_[A-Z_]+$" },
          "origin": { "enum": ["AUTHENTICATED", "INFERRED", "CONFIGURED"] }
        }
      }
    },
    "unresolved_fraction": { "type": "number", "minimum": 0, "maximum": 1 },
    "compiled_at":  { "type": "string", "pattern": "^\\d{4}-\\d{2}-\\d{2}T\\d{2}:\\d{2}:\\d{2}(\\.\\d+)?Z$" },
    "verification": { "type": "object", "additionalProperties": { "type": "boolean" } },
    "timings_ms":   { "type": "object", "additionalProperties": { "type": "number" } }
  },
  "$defs": {
    "digest":  { "type": "string", "pattern": "^sha256:[0-9a-f]{64}$" },
    "abspath": { "type": "string", "pattern": "^/" }
  }
}
